{"activeBlocker":null,"baseSha":"aaaaaaaaaaaaaaaaaaaaaaaaaaaaaaaaaaaaaaaa","blockerHistory":[],"currentWaveIndex":0,"expectedIntegrationSha":"eeeeeeeeeeeeeeeeeeeeeeeeeeeeeeeeeeeeeeee","initialIntegrationSha":"aaaaaaaaaaaaaaaaaaaaaaaaaaaaaaaaaaaaaaaa","integrationBranch":"cb/integration","lastVerifiedIntegrationSha":"eeeeeeeeeeeeeeeeeeeeeeeeeeeeeeeeeeeeeeee","previousState":"wave-verified","runBindingDigest":"sha256:5abd40b715456e8c6c82783b4b5ccdac0e6dbe51edf845000681f335f1e36a40","runId":"cb-20260901-0123456789abcdef","schemaVersion":"compass-builder.run-state.v1","state":"completed","waves":[{"branches":[{"branch":"cb/run/alpha","controllerCheckDigest":"sha256:aaaaaaaaaaaaaaaaaaaaaaaaaaaaaaaaaaaaaaaaaaaaaaaaaaaaaaaaaaaaaaaa","integrationState":"integration-verified","mergeSha":"cccccccccccccccccccccccccccccccccccccccc","postCheckExpectedSha":"cccccccccccccccccccccccccccccccccccccccc","preMergeExpectedSha":"aaaaaaaaaaaaaaaaaaaaaaaaaaaaaaaaaaaaaaaa","storyId":"alpha","verificationState":"verified","workerState":"complete"},{"branch":"cb/run/beta","controllerCheckDigest":"sha256:bbbbbbbbbbbbbbbbbbbbbbbbbbbbbbbbbbbbbbbbbbbbbbbbbbbbbbbbbbbbbbbb","integrationState":"integration-verified","mergeSha":"eeeeeeeeeeeeeeeeeeeeeeeeeeeeeeeeeeeeeeee","postCheckExpectedSha":"eeeeeeeeeeeeeeeeeeeeeeeeeeeeeeeeeeeeeeee","preMergeExpectedSha":"cccccccccccccccccccccccccccccccccccccccc","storyId":"beta","verificationState":"verified","workerState":"complete"}],"startExpectedSha":"aaaaaaaaaaaaaaaaaaaaaaaaaaaaaaaaaaaaaaaa","waveIndex":0}]}
